{"accounting":{"checks":[{"left":10,"name":"no source span reported twice for one scheme","ok":true,"right":10},{"left":10,"name":"candidates = identifiers + excluded","ok":true,"right":10},{"left":10,"name":"identifiers by role sum","ok":true,"right":10},{"left":10,"name":"one marker observation per container","ok":true,"right":10},{"left":10,"name":"every unit in exactly one container","ok":true,"right":10},{"left":10,"name":"source uses = matched + abstained + source_only","ok":true,"right":10},{"left":10,"name":"render uses = matched + unmatched","ok":true,"right":10},{"left":10,"name":"matched pairs are one-to-one","ok":true,"right":10}],"containers":{"bibliography_entry":1,"note":9},"excluded_identifiers":{},"identifiers_by_role":{"marker_target":2,"primary_citation_field":8},"identifiers_by_scheme":{"doi":6,"pmid":4},"identifiers_render":{"no_render_link_in_region":2,"render_link_found":8},"markers":{"missing_template_link_only":2,"no_recognized_warning_in_inspected_region":8},"parse_nodes":300,"render_only_identifiers":0,"render_uses":{"matched":10,"total":10,"unmatched":0},"source_bytes":11496,"units":{"citation_template":8,"unstructured_text":2},"uses":{"anonymous":6,"bound":4},"uses_render":{"matched":10}},"capture":{"capture_sha256":"32beaef306356e0d5d82d4d6788fd4813b3599dcafc9f285882e0cf6c93d94fd","page_id":8685528,"render_artifact":"2a664300c0ce646d527c6655d4e53a00c5fddd0d1e99cc60fb0624fe052968b6","render_state":"captured","revision_id":60748138,"sha1":"098e78b3ffc666b2a0a87c9f6b19fee418c3a81b","source_artifact":"141d55b85475a6928156e1388f529b9b82dffd0e992c5fb630e748f09976185b","title":"جرانيسيترون","wiki":"ar"},"components":{"markers":{"state":"complete"},"reconciliation":{"state":"complete"},"render":{"state":"complete"},"source":{"state":"complete"}},"config":{"max_candidates":50000,"max_depth":60,"max_nodes":400000,"max_refs":20000,"max_render_elements":2000000,"max_templates":50000,"worker_memory_mib":1024,"worker_wall_s":30.0},"config_digest":"07df80eb23600887a7826ba93c1440d0f48cc77ec72cf715a1f548a2d5fe963b","containers":[{"binding_state":"anonymous","definitions":[{"body":{"byte_end":3454,"byte_start":2840,"cp_end":2756,"cp_start":2194},"id":"ct-00001/d1","origin":"tag","source":{"byte_end":3460,"byte_start":2835,"cp_end":2762,"cp_start":2189},"zone":"prose"}],"group":"","group_raw":null,"id":"ct-00001","kind":"note","layout":null,"name":null,"name_raw":null,"render":{"region_id":"cite_note-1","state":"matched"},"source":{"byte_end":3460,"byte_start":2835,"cp_end":2762,"cp_start":2189},"unit_ids":["un-00001"],"use_ids":["us-00001"]},{"binding_state":"anonymous","definitions":[{"body":{"byte_end":4205,"byte_start":3699,"cp_end":3333,"cp_start":2910},"id":"ct-00002/d1","origin":"tag","source":{"byte_end":4211,"byte_start":3694,"cp_end":3339,"cp_start":2905},"zone":"prose"}],"group":"","group_raw":null,"id":"ct-00002","kind":"note","layout":null,"name":null,"name_raw":null,"render":{"region_id":"cite_note-2","state":"matched"},"source":{"byte_end":4211,"byte_start":3694,"cp_end":3339,"cp_start":2905},"unit_ids":["un-00002"],"use_ids":["us-00002"]},{"binding_state":"single_definition","definitions":[{"body":{"byte_end":4714,"byte_start":4334,"cp_end":3744,"cp_start":3415},"id":"ct-00003/d1","origin":"tag","source":{"byte_end":4720,"byte_start":4314,"cp_end":3750,"cp_start":3395},"zone":"prose"}],"group":"","group_raw":null,"id":"ct-00003","kind":"note","layout":null,"name":"WHO22nd","name_raw":"WHO22nd","render":{"region_id":"cite_note-WHO22nd-3","state":"matched"},"source":{"byte_end":4720,"byte_start":4314,"cp_end":3750,"cp_start":3395},"unit_ids":["un-00003"],"use_ids":["us-00003"]},{"binding_state":"anonymous","definitions":[{"body":{"byte_end":5655,"byte_start":5149,"cp_end":4426,"cp_start":3991},"id":"ct-00004/d1","origin":"tag","source":{"byte_end":5661,"byte_start":5144,"cp_end":4432,"cp_start":3986},"zone":"prose"}],"group":"","group_raw":null,"id":"ct-00004","kind":"note","layout":null,"name":null,"name_raw":null,"render":{"region_id":"cite_note-4","state":"matched"},"source":{"byte_end":5661,"byte_start":5144,"cp_end":4432,"cp_start":3986},"unit_ids":["un-00004"],"use_ids":["us-00004"]},{"binding_state":"single_definition","definitions":[{"body":{"byte_end":6762,"byte_start":6267,"cp_end":5215,"cp_start":4791},"id":"ct-00005/d1","origin":"tag","source":{"byte_end":6768,"byte_start":6248,"cp_end":5221,"cp_start":4772},"zone":"prose"}],"group":"","group_raw":null,"id":"ct-00005","kind":"note","layout":null,"name":"Carl2006","name_raw":"Carl2006","render":{"region_id":"cite_note-Carl2006-5","state":"matched"},"source":{"byte_end":6768,"byte_start":6248,"cp_end":5221,"cp_start":4772},"unit_ids":["un-00005"],"use_ids":["us-00005","us-00006"]},{"binding_state":"single_definition","definitions":[{"body":{"byte_end":7356,"byte_start":6938,"cp_end":5687,"cp_start":5329},"id":"ct-00006/d1","origin":"tag","source":{"byte_end":7362,"byte_start":6923,"cp_end":5693,"cp_start":5314},"zone":"prose"}],"group":"","group_raw":null,"id":"ct-00006","kind":"note","layout":null,"name":":0","name_raw":":0","render":{"region_id":"cite_note-:0-6","state":"matched"},"source":{"byte_end":7362,"byte_start":6923,"cp_end":5693,"cp_start":5314},"unit_ids":["un-00006"],"use_ids":["us-00007"]},{"binding_state":"anonymous","definitions":[{"body":{"byte_end":8008,"byte_start":7517,"cp_end":6199,"cp_start":5781},"id":"ct-00007/d1","origin":"tag","source":{"byte_end":8014,"byte_start":7512,"cp_end":6205,"cp_start":5776},"zone":"prose"}],"group":"","group_raw":null,"id":"ct-00007","kind":"note","layout":null,"name":null,"name_raw":null,"render":{"region_id":"cite_note-7","state":"matched"},"source":{"byte_end":8014,"byte_start":7512,"cp_end":6205,"cp_start":5776},"unit_ids":["un-00007"],"use_ids":["us-00008"]},{"binding_state":"anonymous","definitions":[{"body":{"byte_end":9747,"byte_start":9242,"cp_end":7406,"cp_start":6901},"id":"ct-00008/d1","origin":"tag","source":{"byte_end":9753,"byte_start":9237,"cp_end":7412,"cp_start":6896},"zone":"prose"}],"group":"","group_raw":null,"id":"ct-00008","kind":"note","layout":null,"name":null,"name_raw":null,"render":{"region_id":"cite_note-8","state":"matched"},"source":{"byte_end":9753,"byte_start":9237,"cp_end":7412,"cp_start":6896},"unit_ids":["un-00008"],"use_ids":["us-00009"]},{"binding_state":"anonymous","definitions":[{"body":{"byte_end":10601,"byte_start":10331,"cp_end":8005,"cp_start":7735},"id":"ct-00009/d1","origin":"tag","source":{"byte_end":10607,"byte_start":10326,"cp_end":8011,"cp_start":7730},"zone":"prose"}],"group":"","group_raw":null,"id":"ct-00009","kind":"note","layout":null,"name":null,"name_raw":null,"render":{"region_id":"cite_note-9","state":"matched"},"source":{"byte_end":10607,"byte_start":10326,"cp_end":8011,"cp_start":7730},"unit_ids":["un-00009"],"use_ids":["us-00010"]},{"binding_state":"not_applicable","definitions":[],"group":"","group_raw":null,"id":"ct-00010","kind":"bibliography_entry","layout":"list_item","name":null,"name_raw":null,"render":{"region_id":"about:#mwt41","state":"matched"},"source":{"byte_end":11007,"byte_start":10669,"cp_end":8330,"cp_start":8050},"unit_ids":["un-00010"],"use_ids":[]}],"exceptions":[],"excluded_identifiers":[],"extraction_digest":"1c2ce1aecae01d6c2baa13cea282c5c556b5483a769a346a3b130ad4a49b13f1","extractor":{"name":"citerift-wiki","normalizer":"citerift.retraction.identifiers (Stage 02)","parsers":{"html":"lxml 6.1.3 (libxml2 2.14.6)","wikitext":"mwparserfromhell 0.7.2"},"profile":{"digest":"ba5ae18b34ec3824cae770548d4e929bec6891e8dfdc72f591ddfdd12cc3a697","version":"1.0.0"},"version":"1.0.0"},"identifiers":[{"boundary":"field","container_id":"ct-00004","context":{"in_link_text":false,"param":"pmid","template":{"canonical":"استشهاد بدورية محكمة","family":"journal","kind":"citation","name":"استشهاد بدورية محكمة"}},"decoding":{"input_steps":[],"normalizer_input":" 20091591 ","structural_steps":[]},"id":"id-00001","normalization":{"input_form":"bare","issues":[],"missing":false,"normalized":"20091591","raw":" 20091591 ","scheme":"pmid","transformations":["TRIM_OUTER_WHITESPACE"],"valid":true},"origin":"template_field","render":{"state":"render_link_found","witnesses":[{"element_id":"mwdQ","id_unique":true,"path":"/html/body/section[7]/div[1]/div/div/ol/li[4]/span[2]/cite/a[4]","quote":"20091591","subtree_sha256":"490af2aa4bc7a70a2e080e9b87bfe18620068d72e58d3a4875bbfe3d950c8b9b"}]},"role":"primary_citation_field","role_reason":"citation parameter pmid","scheme":"pmid","source":{"byte_end":5546,"byte_start":5536,"cp_end":4317,"cp_start":4307,"exact":true,"raw":" 20091591 ","raw_sha256":"6d64864c137d3affae213eebc01cb7ef6b57a0917fa91e615f3ef9fe856acd10"},"unit_id":"un-00004"},{"boundary":"field","container_id":"ct-00004","context":{"in_link_text":false,"param":"doi","template":{"canonical":"استشهاد بدورية محكمة","family":"journal","kind":"citation","name":"استشهاد بدورية محكمة"}},"decoding":{"input_steps":[],"normalizer_input":" 10.1002/14651858.CD006272.pub2 ","structural_steps":[]},"id":"id-00002","normalization":{"input_form":"bare","issues":[],"missing":false,"normalized":"10.1002/14651858.cd006272.pub2","raw":" 10.1002/14651858.CD006272.pub2 ","scheme":"doi","transformations":["TRIM_OUTER_WHITESPACE","ASCII_CASE_FOLD"],"valid":true},"origin":"template_field","render":{"state":"render_link_found","witnesses":[{"element_id":"mwcw","id_unique":true,"path":"/html/body/section[7]/div[1]/div/div/ol/li[4]/span[2]/cite/a[2]","quote":"10.1002/14651858.CD006272.pub2","subtree_sha256":"418ae63dae9c1371d90b45d67bd743136901e556beceb88a9b7b1f1c4838e845"}]},"role":"primary_citation_field","role_reason":"citation parameter doi","scheme":"doi","source":{"byte_end":5585,"byte_start":5553,"cp_end":4356,"cp_start":4324,"exact":true,"raw":" 10.1002/14651858.CD006272.pub2 ","raw_sha256":"aafbee20cba8334232181e933d2559eaf20585274135873cba3c35f789ea0bce"},"unit_id":"un-00004"},{"boundary":"field","container_id":"ct-00004","context":{"in_